{
  "$schema": "https://json-schema.org/draft/2020-12/schema",
  "$id": "https://wyrcan-io.github.io/playtestr/schema/playtestr-spec-v3.schema.json",
  "title": "Playtestr specification version 3",
  "type": "object",
  "additionalProperties": false,
  "required": [
    "version",
    "command",
    "workspace",
    "steps"
  ],
  "properties": {
    "version": {
      "const": 3
    },
    "name": {
      "type": "string"
    },
    "command": {
      "type": "array",
      "minItems": 1,
      "prefixItems": [
        {
          "type": "string",
          "minLength": 1
        }
      ],
      "items": {
        "type": "string"
      }
    },
    "workspace": {
      "type": "object",
      "additionalProperties": false,
      "required": [
        "fixture"
      ],
      "properties": {
        "fixture": {
          "type": "string",
          "minLength": 1,
          "pattern": "^(?!\\.\\.?$)(?![A-Za-z]:)(?![/\\\\])(?!.*(?:^|[/\\\\])\\.\\.(?:[/\\\\]|$)).+"
        },
        "cwd": {
          "type": "string",
          "minLength": 1,
          "pattern": "^(?!\\.\\.$)(?![A-Za-z]:)(?![/\\\\])(?!.*(?:^|[/\\\\])\\.\\.(?:[/\\\\]|$)).+",
          "default": "."
        },
        "home": {
          "const": "temporary"
        },
        "temp": {
          "const": "temporary"
        }
      }
    },
    "env": {
      "type": "object",
      "propertyNames": {
        "pattern": "^[A-Za-z_][A-Za-z0-9_]*$"
      },
      "additionalProperties": {
        "type": "string"
      }
    },
    "inherit_env": {
      "type": "array",
      "items": {
        "type": "string",
        "pattern": "^[A-Za-z_][A-Za-z0-9_]*$"
      }
    },
    "width": {
      "type": "integer",
      "minimum": 1,
      "maximum": 500,
      "default": 80
    },
    "height": {
      "type": "integer",
      "minimum": 1,
      "maximum": 200,
      "default": 24
    },
    "timeout_ms": {
      "type": "integer",
      "minimum": 1,
      "maximum": 120000,
      "default": 3000
    },
    "run_timeout_ms": {
      "type": "integer",
      "minimum": 1,
      "maximum": 3600000,
      "default": 30000
    },
    "startup_timeout_ms": {
      "type": "integer",
      "minimum": 0,
      "maximum": 120000
    },
    "max_output_bytes": {
      "type": "integer",
      "minimum": 1,
      "maximum": 1000000000,
      "default": 2000000
    },
    "steps": {
      "type": "array",
      "description": "At most 1000 ordered terminal/state actions in total. Aggregate expected state bytes remain bounded by the runner.",
      "minItems": 1,
      "maxItems": 1000,
      "items": {
        "$ref": "#/$defs/step"
      }
    }
  },
  "$defs": {
    "size": {
      "type": "object",
      "additionalProperties": false,
      "required": [
        "width",
        "height"
      ],
      "properties": {
        "width": {
          "type": "integer",
          "minimum": 1,
          "maximum": 500
        },
        "height": {
          "type": "integer",
          "minimum": 1,
          "maximum": 200
        }
      }
    },
    "step": {
      "type": "object",
      "additionalProperties": false,
      "oneOf": [
        {
          "required": [
            "key"
          ]
        },
        {
          "required": [
            "text"
          ]
        },
        {
          "required": [
            "expect"
          ]
        },
        {
          "required": [
            "expect_not"
          ]
        },
        {
          "required": [
            "wait_for_redraw"
          ]
        },
        {
          "required": [
            "snapshot"
          ]
        },
        {
          "required": [
            "exit"
          ]
        },
        {
          "required": [
            "resize"
          ]
        },
        {
          "required": [
            "state"
          ]
        }
      ],
      "properties": {
        "key": {
          "enum": [
            "Enter",
            "ArrowDown",
            "ArrowUp",
            "ArrowRight",
            "ArrowLeft",
            "Home",
            "End",
            "PageUp",
            "PageDown",
            "Escape",
            "Tab",
            "Backspace",
            "CtrlSpace",
            "CtrlA",
            "CtrlB",
            "CtrlC",
            "CtrlD",
            "CtrlE",
            "CtrlF",
            "CtrlG",
            "CtrlH",
            "CtrlI",
            "CtrlJ",
            "CtrlK",
            "CtrlL",
            "CtrlM",
            "CtrlN",
            "CtrlO",
            "CtrlP",
            "CtrlQ",
            "CtrlR",
            "CtrlS",
            "CtrlT",
            "CtrlU",
            "CtrlV",
            "CtrlW",
            "CtrlX",
            "CtrlY",
            "CtrlZ"
          ]
        },
        "text": {
          "type": "string",
          "minLength": 1
        },
        "expect": {
          "type": "string",
          "minLength": 1
        },
        "expect_not": {
          "type": "string",
          "minLength": 1
        },
        "wait_for_redraw": {
          "const": true
        },
        "snapshot": {
          "type": "string",
          "pattern": "^[^/\\:]+$"
        },
        "exit": {
          "type": "integer",
          "minimum": 0,
          "maximum": 4294967295
        },
        "resize": {
          "$ref": "#/$defs/size"
        },
        "state": {
          "$ref": "#/$defs/state"
        }
      }
    },
    "state": {
      "type": "object",
      "additionalProperties": false,
      "required": [
        "path",
        "kind"
      ],
      "properties": {
        "path": {
          "type": "string",
          "minLength": 1,
          "maxLength": 4096
        },
        "kind": {
          "enum": [
            "file",
            "absent",
            "directory",
            "empty_directory",
            "entries"
          ]
        },
        "bytes_base64": {
          "type": "string",
          "maxLength": 87384,
          "contentEncoding": "base64"
        },
        "entries": {
          "type": "array",
          "maxItems": 256,
          "uniqueItems": true,
          "items": {
            "type": "string",
            "minLength": 1
          }
        }
      },
      "allOf": [
        {
          "if": {
            "properties": {
              "kind": {
                "const": "file"
              }
            }
          },
          "then": {
            "required": [
              "bytes_base64"
            ],
            "not": {
              "required": [
                "entries"
              ]
            }
          },
          "else": {
            "not": {
              "required": [
                "bytes_base64"
              ]
            }
          }
        },
        {
          "if": {
            "properties": {
              "kind": {
                "const": "entries"
              }
            }
          },
          "then": {
            "required": [
              "entries"
            ]
          },
          "else": {
            "not": {
              "required": [
                "entries"
              ]
            }
          }
        }
      ]
    }
  }
}
