{
  "version": 3,
  "env": {
    "GIT_CONFIG_GLOBAL": "/dev/null",
    "GIT_CONFIG_NOSYSTEM": "1",
    "POETRY_KEYRING_ENABLED": "false",
    "PYTHONDONTWRITEBYTECODE": "1",
    "PYTHONNOUSERSITE": "1"
  },
  "width": 100,
  "height": 28,
  "timeout_ms": 10000,
  "run_timeout_ms": 120000,
  "max_output_bytes": 2000000,
  "name": "Poetry E10",
  "command": [
    "poetry",
    "--no-plugins",
    "source",
    "add",
    "--priority=supplemental",
    "PRIVATE",
    "https://packages.example.invalid/simple/"
  ],
  "workspace": {
    "fixture": "source-fixture",
    "home": "temporary",
    "temp": "temporary"
  },
  "steps": [
    {
      "expect": "already exists. Updating."
    },
    {
      "exit": 0
    },
    {
      "state": {
        "path": "pyproject.toml",
        "kind": "file",
        "bytes_base64": "IyBwcmVzZXJ2ZSB0aGlzIHJldmlld2VkIGNvbW1lbnQKW3Byb2plY3RdCm5hbWUgPSAiZml4dHVyZS1hcHAiCnZlcnNpb24gPSAiMS4yLjMiCmRlc2NyaXB0aW9uID0gIlJldmlld2VkIGxvY2FsIGZpeHR1cmUiCnJlcXVpcmVzLXB5dGhvbiA9ICI+PTMuMTAiCnJlYWRtZSA9ICJSRUFETUUubWQiCmF1dGhvcnMgPSBbe25hbWUgPSAiRml4dHVyZSBBdXRob3IiLCBlbWFpbCA9ICJhdXRob3JAZXhhbXBsZS5pbnZhbGlkIn1dCmRlcGVuZGVuY2llcyA9IFtdCgpbYnVpbGQtc3lzdGVtXQpyZXF1aXJlcyA9IFsicG9ldHJ5LWNvcmU+PTIuMC4wLDwzLjAuMCJdCmJ1aWxkLWJhY2tlbmQgPSAicG9ldHJ5LmNvcmUubWFzb25yeS5hcGkiCgpbW3Rvb2wucG9ldHJ5LnNvdXJjZV1dCm5hbWUgPSAiUFJJVkFURSIKdXJsID0gImh0dHBzOi8vcGFja2FnZXMuZXhhbXBsZS5pbnZhbGlkL3NpbXBsZS8iCnByaW9yaXR5ID0gInN1cHBsZW1lbnRhbCIKCg=="
      }
    },
    {
      "state": {
        "path": "sentinel.txt",
        "kind": "file",
        "bytes_base64": "cmV2aWV3ZWQgZXhpc3Rpbmcgd29yawo="
      }
    }
  ]
}
