{
  "command": [
    "../../../../artifacts/runner-readiness-next-twenty-project-pass/active/commitizen-python/venv/Scripts/python.exe",
    "-B",
    "-m",
    "commitizen",
    "init"
  ],
  "env": {
    "GIT_CONFIG_GLOBAL": "nul",
    "GIT_CONFIG_NOSYSTEM": "1",
    "GIT_TERMINAL_PROMPT": "0",
    "PATH": "C:\\Program Files\\Git\\cmd;C:\\WINDOWS\\System32",
    "PYTHONDONTWRITEBYTECODE": "1",
    "PYTHONIOENCODING": "utf-8",
    "PYTHONNOUSERSITE": "1",
    "TZ": "UTC"
  },
  "height": 32,
  "inherit_env": [
    "SYSTEMROOT",
    "WINDIR"
  ],
  "max_output_bytes": 2000000,
  "name": "Reject an unavailable configured convention without changes",
  "run_timeout_ms": 120000,
  "steps": [
    {
      "expect": "committer has not been found"
    },
    {
      "exit": 1
    },
    {
      "state": {
        "bytes_base64": "W3Rvb2wuY29tbWl0aXplbl0KbmFtZSA9ICJ1bmF2YWlsYWJsZV9zeW50aGV0aWNfcnVsZSIK",
        "kind": "file",
        "path": ".cz.toml"
      }
    },
    {
      "state": {
        "bytes_base64": "VW5yZWxhdGVkIHN5bnRoZXRpYyBwcm9qZWN0IGZpbGUgc3RheXMgdW5jaGFuZ2VkLgo=",
        "kind": "file",
        "path": "sentinel.txt"
      }
    },
    {
      "state": {
        "entries": [
          ".cz.toml",
          ".git",
          "sentinel.txt"
        ],
        "kind": "entries",
        "path": "."
      }
    }
  ],
  "timeout_ms": 10000,
  "version": 3,
  "width": 120,
  "workspace": {
    "cwd": ".",
    "fixture": "fixtures/e12",
    "home": "temporary",
    "temp": "temporary"
  }
}
