{
  "version": 3,
  "name": "Vis N08: search for a later word and change only that match",
  "command": [
    "vis",
    "note.txt"
  ],
  "workspace": {
    "fixture": "fixtures/N08",
    "cwd": ".",
    "home": "temporary",
    "temp": "temporary"
  },
  "env": {
    "LC_ALL": "en_US.UTF-8",
    "TERM": "xterm-256color"
  },
  "width": 100,
  "height": 28,
  "timeout_ms": 10000,
  "run_timeout_ms": 120000,
  "max_output_bytes": 2000000,
  "steps": [
    {
      "expect": "alpha bravo charlie"
    },
    {
      "text": "/bravo"
    },
    {
      "key": "Enter"
    },
    {
      "text": "cw"
    },
    {
      "expect": "INSERT"
    },
    {
      "text": "reviewed"
    },
    {
      "key": "Escape"
    },
    {
      "expect_not": "INSERT"
    },
    {
      "expect": "alpha reviewed charlie"
    },
    {
      "expect": "[+]"
    },
    {
      "text": ":w"
    },
    {
      "key": "Enter"
    },
    {
      "expect_not": "[+]"
    },
    {
      "text": ":q"
    },
    {
      "key": "Enter"
    },
    {
      "exit": 0
    },
    {
      "state": {
        "path": "note.txt",
        "kind": "file",
        "bytes_base64": "YWxwaGEgcmV2aWV3ZWQgY2hhcmxpZQo="
      }
    },
    {
      "state": {
        "path": "sentinel.txt",
        "kind": "file",
        "bytes_base64": "cHJlc2VydmUgcmV2aWV3ZWQgZXhpc3Rpbmcgd29yawo="
      }
    },
    {
      "state": {
        "path": ".",
        "kind": "entries",
        "entries": [
          "note.txt",
          "sentinel.txt"
        ]
      }
    }
  ]
}
