{
  "version": 3,
  "name": "Hygen E06: dry-run without creating a destination",
  "command": [
    "hygen",
    "work",
    "new",
    "--dry"
  ],
  "workspace": {
    "fixture": "fixtures/E06",
    "cwd": ".",
    "home": "temporary",
    "temp": "temporary"
  },
  "env": {
    "TERM": "xterm-256color"
  },
  "width": 100,
  "height": 28,
  "timeout_ms": 10000,
  "run_timeout_ms": 120000,
  "max_output_bytes": 2000000,
  "steps": [
    {
      "expect": "Message for file?"
    },
    {
      "snapshot": "E06-prompt.rows.json"
    },
    {
      "text": "reviewed"
    },
    {
      "expect": "reviewed"
    },
    {
      "key": "Enter"
    },
    {
      "expect": "added: generated/result.txt"
    },
    {
      "exit": 0
    },
    {
      "state": {
        "path": ".hygen.js",
        "kind": "file",
        "bytes_base64": "bW9kdWxlLmV4cG9ydHMgPSB7fTsK"
      }
    },
    {
      "state": {
        "path": "_templates/work/new/output.ejs.t",
        "kind": "file",
        "bytes_base64": "LS0tCnRvOiAiZ2VuZXJhdGVkL3Jlc3VsdC50eHQiCi0tLQpIZWxsbywgPCU9IG1lc3NhZ2UgJT4hCg=="
      }
    },
    {
      "state": {
        "path": "_templates/work/new/prompt.js",
        "kind": "file",
        "bytes_base64": "bW9kdWxlLmV4cG9ydHMgPSBbeyJ0eXBlIjogImlucHV0IiwgIm5hbWUiOiAibWVzc2FnZSIsICJtZXNzYWdlIjogIk1lc3NhZ2UgZm9yIGZpbGU/In1dOwo="
      }
    },
    {
      "state": {
        "path": "sentinel.bin",
        "kind": "file",
        "bytes_base64": "cHJlc2VydmUAZXhpc3RpbmcNCg=="
      }
    },
    {
      "state": {
        "path": "generated",
        "kind": "absent"
      }
    },
    {
      "state": {
        "path": "generated/result.txt",
        "kind": "absent"
      }
    },
    {
      "state": {
        "path": ".",
        "kind": "entries",
        "entries": [
          "_templates",
          ".hygen.js",
          "sentinel.bin"
        ]
      }
    },
    {
      "state": {
        "path": "_templates",
        "kind": "entries",
        "entries": [
          "work"
        ]
      }
    },
    {
      "state": {
        "path": "_templates/work",
        "kind": "entries",
        "entries": [
          "new"
        ]
      }
    },
    {
      "state": {
        "path": "_templates/work/new",
        "kind": "entries",
        "entries": [
          "prompt.js",
          "output.ejs.t"
        ]
      }
    }
  ]
}
