{
  "version": 3,
  "name": "fff N03: rename a file while preserving its exact contents",
  "command": [
    "fff"
  ],
  "workspace": {
    "fixture": "fixtures/N03",
    "cwd": ".",
    "home": "temporary",
    "temp": "temporary"
  },
  "env": {
    "FFF_CD_ON_EXIT": "1",
    "FFF_LS_COLORS": "0",
    "FFF_TRASH": "trash",
    "LC_ALL": "en_US.UTF-8",
    "TERM": "xterm-256color"
  },
  "width": 100,
  "height": 28,
  "timeout_ms": 10000,
  "run_timeout_ms": 120000,
  "max_output_bytes": 2000000,
  "steps": [
    {
      "expect": "source.txt"
    },
    {
      "text": "/source.txt"
    },
    {
      "expect": "/source.txt"
    },
    {
      "key": "Enter"
    },
    {
      "expect_not": "/source.txt"
    },
    {
      "text": "r"
    },
    {
      "expect": "rename source.txt:"
    },
    {
      "text": "renamed.txt"
    },
    {
      "key": "Enter"
    },
    {
      "expect_not": "rename source.txt:"
    },
    {
      "expect": "renamed.txt"
    },
    {
      "text": "q"
    },
    {
      "exit": 0
    },
    {
      "state": {
        "path": "renamed.txt",
        "kind": "file",
        "bytes_base64": "cmV2aWV3ZWQgc291cmNlCg=="
      }
    },
    {
      "state": {
        "path": "sentinel.txt",
        "kind": "file",
        "bytes_base64": "cHJlc2VydmUgcmV2aWV3ZWQgZXhpc3Rpbmcgd29yawo="
      }
    },
    {
      "state": {
        "path": "source.txt",
        "kind": "absent"
      }
    },
    {
      "state": {
        "path": ".",
        "kind": "entries",
        "entries": [
          "trash",
          "sentinel.txt",
          "renamed.txt"
        ]
      }
    },
    {
      "state": {
        "path": "trash",
        "kind": "entries",
        "entries": []
      }
    }
  ]
}
