{
  "version": 3,
  "name": "Hygen E11: create an exactly empty file",
  "command": [
    "hygen",
    "work",
    "new"
  ],
  "workspace": {
    "fixture": "fixtures/E11",
    "cwd": ".",
    "home": "temporary",
    "temp": "temporary"
  },
  "env": {
    "TERM": "xterm-256color"
  },
  "width": 100,
  "height": 28,
  "timeout_ms": 10000,
  "run_timeout_ms": 120000,
  "max_output_bytes": 2000000,
  "steps": [
    {
      "expect": "Message for file?"
    },
    {
      "snapshot": "E11-prompt.rows.json"
    },
    {
      "text": "reviewed"
    },
    {
      "expect": "reviewed"
    },
    {
      "key": "Enter"
    },
    {
      "expect": "added: generated/empty.txt"
    },
    {
      "exit": 0
    },
    {
      "state": {
        "path": ".hygen.js",
        "kind": "file",
        "bytes_base64": "bW9kdWxlLmV4cG9ydHMgPSB7fTsK"
      }
    },
    {
      "state": {
        "path": "_templates/work/new/output.ejs.t",
        "kind": "file",
        "bytes_base64": "LS0tCnRvOiAiZ2VuZXJhdGVkL2VtcHR5LnR4dCIKLS0tCg=="
      }
    },
    {
      "state": {
        "path": "_templates/work/new/prompt.js",
        "kind": "file",
        "bytes_base64": "bW9kdWxlLmV4cG9ydHMgPSBbeyJ0eXBlIjogImlucHV0IiwgIm5hbWUiOiAibWVzc2FnZSIsICJtZXNzYWdlIjogIk1lc3NhZ2UgZm9yIGZpbGU/In1dOwo="
      }
    },
    {
      "state": {
        "path": "generated/empty.txt",
        "kind": "file",
        "bytes_base64": ""
      }
    },
    {
      "state": {
        "path": "sentinel.bin",
        "kind": "file",
        "bytes_base64": "cHJlc2VydmUAZXhpc3RpbmcNCg=="
      }
    },
    {
      "state": {
        "path": ".",
        "kind": "entries",
        "entries": [
          "generated",
          ".hygen.js",
          "_templates",
          "sentinel.bin"
        ]
      }
    },
    {
      "state": {
        "path": "_templates",
        "kind": "entries",
        "entries": [
          "work"
        ]
      }
    },
    {
      "state": {
        "path": "_templates/work",
        "kind": "entries",
        "entries": [
          "new"
        ]
      }
    },
    {
      "state": {
        "path": "_templates/work/new",
        "kind": "entries",
        "entries": [
          "output.ejs.t",
          "prompt.js"
        ]
      }
    },
    {
      "state": {
        "path": "generated",
        "kind": "entries",
        "entries": [
          "empty.txt"
        ]
      }
    }
  ]
}
